,Birthdate,Description,Image,Name
121,1961-02-11,"Rajat Kapoor was born on February 11, 1961 in New Delhi, India. He is an actor and director, known for Raghu Romeo (2003), Ankhon Dekhi (2013) and Bheja Fry (2007).",https://m.media-amazon.com/images/M/MV5BNDBlM2ZiZmEtYzYyMC00ZWNlLTkxMzQtOGFlMzgxZDg5NjdhXkEyXkFqcGdeQXVyMTExNDQ2MTI@._V1_.jpg,Rajat Kapoor
122,1982-09-28,"Son of Rishi Kapoor and Neetu Singh; nephew of actors Randhir Kapoor, Rajiv Kapoor, Kunal Kapoor. Grandnephew of actors Shashi Kapoor, Jennifer Kendal, Shammi Kapoor, Geeta Bali; cousin of actresses Kareena Kapoor, Karisma Kapoor. Belongs to the fourth generation of highly prestigious and considered to be the first family of Bollywood (Hindi film ...",https://m.media-amazon.com/images/M/MV5BMTk2ODU5Mjk2MV5BMl5BanBnXkFtZTcwODEzNDg3OA@@._V1_.jpg,Ranbir Kapoor
123,1957-06-25,"Raghuvir Yadav was born on June 25, 1957 in Jabalpur, Madhya Pradesh, India. He is known for his work on Dil Se.. (1998), Lagaan: Once Upon a Time in India (2001) and Peepli (Live) (2010).",https://m.media-amazon.com/images/M/MV5BNTIzOWZhMjctNTBkMi00YTc0LThhOGYtMDFlZmI4ZmNkZTZiXkEyXkFqcGdeQXVyMTExNDQ2MTI@._V1_.jpg,Raghuvir Yadav
124,,Raj Kumar is also known as Rajkummar Rao. He was born in Gurgaon. He finished his schooling in Gurgaon and graduated in Arts from Delhi University. He was simultaneously doing theatre with Kshitij Repertory and SRC in Delhi. He is an Acting graduate from Pune\u0027s Film and Television Institute of India. Raj Kumar\u0027s debut film was Dibakar Banerjee\u0027s ...,https://m.media-amazon.com/images/M/MV5BMzAxNWIzOWItMDM1NC00NGMyLWIwMDEtNWZjODEyOTFiZjQ4XkEyXkFqcGdeQXVyNjY1MTg4Mzc@._V1_.jpg,Rajkummar Rao
125,1966-07-08,"Revathy was born on July 8, 1966 in Kochi, Kerala, India as Asha Kelunni. She is an actress and director, known for Thevar Magan (1992), Kizhakku Vasal (1990) and Man Vasanai (1983). She was previously married to Menon, Suresh.",https://m.media-amazon.com/images/M/MV5BZjc4NTAwMmQtMWQyMS00NGU4LWEzNmYtZTMyODJhOGZjMGRiXkEyXkFqcGdeQXVyNDUzOTQ5MjY@._V1_.jpg,Revathy
126,1926-10-08,"Raaj Kumar was born on October 8, 1926 in Loralai, Baluchistan, British India as Kulbhushan Pandit. He is known for his work on Kaajal (1965), Waqt (1965) and Dil Ek Mandir (1963). He died on July 3, 1996 in Mumbai, Maharashtra, India.",https://m.media-amazon.com/images/M/MV5BZjNlMTdhYjYtODI0My00OTA2LTlkM2QtMGU5N2RhNWVlMWVjXkEyXkFqcGdeQXVyMTExNDQ2MTI@._V1_.jpg,Raaj Kumar
127,1970-09-15,"Ramya Krishnan was born on September 15, 1970 in Madras, Tamil Nadu, India. She is an actress, known for B\u0026atilde;hubali: The Beginning (2015), Baahubali 2: The Conclusion (2017) and Padaiyappa (1999). She has been married to Krishna Vamsi since July 11, 2003. They have one child.",https://m.media-amazon.com/images/M/MV5BZThmMmJlZGQtZDgyMy00YmIyLTk1NDQtMGQ0N2EzYzUxMWNiXkEyXkFqcGdeQXVyMjYwMDk5NjE@._V1_.jpg,Ramya Krishnan
128,1950-12-12,"Rajinikanth has been a megastar in the Tamil movie industry since the 70s. He is one of the highest earning actors in Asia. Primarily starring in Tamil movies, he has also worked in Hindi, Telugu, Kannada, and American movies. He was born in Bangalore (India), and was employed as a bus conductor before he joined the Madras Film Institute. He made ...",https://m.media-amazon.com/images/M/MV5BMTA3MDcyNzkxMjZeQTJeQWpwZ15BbWU3MDUxMTU4Njg@._V1_.jpg,Rajinikanth
129,1978-03-21,"Mukerji comes from a film-oriented family of Bengali origin. Her father, Ram Mukherjee, is a retired director and one of the founders of \",https://m.media-amazon.com/images/M/MV5BMjI4MjI2MTEwOV5BMl5BanBnXkFtZTgwMzkxMDU0OTE@._V1_.jpg,Rani Mukerji
130,1985-07-06,"Ranveer Singh is an Indian actor working in Bollywood. Born in Mumbai, India, Ranveer Singh had always wanted to be an actor since his childhood. However, during his college days he felt that the idea of acting was far-fetched and focused on creative writing. While pursuing his Bachelor of Arts degree from Indiana University (Bloomington), Singh ...",https://m.media-amazon.com/images/M/MV5BMTExOTcwMDU4NTReQTJeQWpwZ15BbWU3MDA0MjE1MTc@._V1_.jpg,Ranveer Singh
131,1952-09-04,"Born in south Mumbai, Kapoor is the second son of film director and actor Raj Kapoor. He did his schooling with his brothers at Campion School,Mumbai. His brothers are well-known actors, Randhir Kapoor and Rajiv Kapoor. Rishi Kapoor debuted in his father\u0027s 1970 film Mera Naam Joker, playing his father\u0027s role as a child. Rishi Kapoor had his first ...",https://m.media-amazon.com/images/M/MV5BMjJmNjM1YmUtNTA2Zi00Y2U0LTgyZTItMjQ5MTE4NWJhMDgyXkEyXkFqcGdeQXVyMTExNDQ2MTI@._V1_.jpg,Rishi Kapoor
132,1942-12-29,"Rajesh Khanna, the first superstar of Indian and Hindi Cinema with 74 Golden Jubilee Hits - (which includes 48 Platinum Jubilee hits and 26 Golden Jubilee Hits) \u0026 in addition had 22 Silver Jubilee Hits and 9 average hits, was born on 29 December 1942 in Amritsar, Punjab, India.Rajesh entered Hindi films in the year 1965 when he began shooting for ...",https://m.media-amazon.com/images/M/MV5BMTQ1OTE5NDEwNV5BMl5BanBnXkFtZTcwNjgzMTcxOA@@._V1_.jpg,Rajesh Khanna
133,1958-12-10,"Raghuvaran was born on December 10, 1958 in Kollankod, Palakkad, Kerala, India as Raghuvaran Velayutham Nair. He was an actor, known for Mudhalvan (1999), Amarkalam (1999) and Kadhalan. He was married to Rohini. He died on March 19, 2008 in Chennai, Tamil Nadu, India.",https://m.media-amazon.com/images/M/MV5BZjM0NmMyZTYtYmY3My00NDFkLTk1YTAtOGE3YTVjMGMyNzQ5XkEyXkFqcGdeQXVyMjYwMDk5NjE@._V1_.jpg,Raghuvaran
134,1952-06-23,"Raj Babbar was born on June 23, 1952 in Tundla, Uttar Pradesh, India. He is an actor, known for Pukaar (2014), Aaj Ki Awaz (1984) and Umrao Jaan (1981). He is married to Nadira Babbar. They have two children. He was previously married to Smita Patil.",https://m.media-amazon.com/images/M/MV5BMTQ1MjEwMjM3MF5BMl5BanBnXkFtZTgwNjM4NDczMDE@._V1_.jpg,Raj Babbar
135,1924-12-14,"Raj Kapoor was the son of well-known Indian actor Prithviraj Kapoor, who acted both in film and on stage. After apprenticing in the Bollywood production studios of the 1940\u0027s, at 24 years of age Raj Kapoor produced, directed and acted in Aag (1948), with his new company, RK Films. His next production, Barsaat (1949), was a smash hit. In 1951, he ...",https://m.media-amazon.com/images/M/MV5BNjYwODQzMjk3Ml5BMl5BanBnXkFtZTYwNzIxMjky._V1_.jpg,Raj Kapoor
136,1960-05-22,"Rajit Kapoor was born on May 22, 1960 in Amritsar, Punjab, India. He is an actor and director, known for The Making of the Mahatma (1996), Uri: The Surgical Strike (2019) and Suraj Ka Satvan Ghoda (1992).",https://m.media-amazon.com/images/M/MV5BZDhlNDEwMjgtMWY5NC00MGEyLThhODEtZjAyYzIyMmU1ZDUxXkEyXkFqcGdeQXVyMTExNDQ2MTI@._V1_.jpg,Rajit Kapoor
137,,"Radhika Apte is a well-known Indian theatre and film actress born in Vellore and brought up in Pune. Before endeavoring into films, she began with theatre. Radhika Apte is a perfect example of beauty with brains. Apte is an Economics and Mathematics graduate from Fergusson College, Pune. Apte during her growing up days in Pune, she learned Kathak ...",https://m.media-amazon.com/images/M/MV5BZmQ0NjY5YmItMTAwOC00MWVlLThkZTgtYmZhMDg1ZjY2ODMwXkEyXkFqcGdeQXVyNjM5MTI3ODQ@._V1_.jpg,Radhika Apte
138,1947-08-15,"Rakhee was born in a Bengali-speaking family in West Bengal, on India\u0027s Independence Day - 15th August, 1947. She has no connections with anyone in the film industry in India. She achieved phenomenal success at her very first movie in Bengali \u0027Bandhu Baran\u0027 during the year 1967. She was then noticed by noted Bollywood actor, Sunil Dutt, who ...",https://m.media-amazon.com/images/M/MV5BMDVlNTM4YTUtNjA2My00OWQ0LThjYzAtYmU0ZGQ0NGE3YjQ1XkEyXkFqcGdeQXVyNDUzOTQ5MjY@._V1_.jpg,Rakhee Gulzar
139,1978-12-17,"Riteish Deshmukh is an Indian actor, producer and architect who appears in Bollywood films. He is the son of Late. Vilasrao Deshmukh, the former Union Minister for Science, Technology and Earth Sciences, Government of India, and the former Chief Minister of Maharashtra. Riteish debuted with K. Vijaya Bhaskar\u0027s Tujhe Meri Kasam (2003) with his ...",https://m.media-amazon.com/images/M/MV5BMTU3NDM3NDM3Ml5BMl5BanBnXkFtZTgwMzk4ODEzOTE@._V1_.jpg,Riteish Deshmukh
140,1972-08-18,"Ranvir comes from a family of movie professionals. His father is Writer, Producer and Director KD Shorey and He has 2 older Brothers, Lokesh Shorey an actor and Shrinath Shorey a movie Writer and Director. Ranvir though born in Panjab, was raised and educated in Mumbai. He was very active in dramatics in school and later in college.",https://m.media-amazon.com/images/M/MV5BMTIzOTE5MzMyMl5BMl5BanBnXkFtZTcwMjAyNzAyMg@@._V1_.jpg,Ranvir Shorey
141,,"Richa began her career as a model and then she moved to theater. She has performed plays touring in India and Pakistan. Later, she also received her training under Barry John Richa acted in the critically acclaimed movie Oye Lucky! Lucky Oye! as the character of Dolly, both the movie and her role were well appreciated. She was cast by Anurag ...",https://m.media-amazon.com/images/M/MV5BOTQ3MzVkNjUtODYwNi00N2Q2LTg3YTAtNDUxM2JiNDViN2IyXkEyXkFqcGdeQXVyNDUzOTQ5MjY@._V1_.jpg,Richa Chadha
142,1971-03-16,"Rajpal Yadav was born on March 16, 1971 in Shahjahanpur, Uttar Pradesh, India. He is an actor and writer, known for Kal ho naa ho (2003), Jungle (2000) and Main, Meri Patni... Aur Woh! (2005). He has been married to Radha Yadav since June 10, 2003.",https://m.media-amazon.com/images/M/MV5BMTQ3MTI4MzUyNl5BMl5BanBnXkFtZTgwMjAzMTMzOTE@._V1_.jpg,Rajpal Yadav
143,1963-12-25,"Raju Srivastav (born Satyaprakash Srivastava) often credited as Raju Shrivastav or Raju Srivastava, is an Indian comedian, and more popularly, an observational comedian. He is known most for his acute scrutiny and comical timing about various Indian aspects of life. Satyaprakash Srivastava was born in Kanpur, India in a middle class Kayastha family...",https://m.media-amazon.com/images/M/MV5BZjc5MTYwYjEtZmJiMC00YzA3LThiZGYtMWY2NjE2ZDNmYWFjXkEyXkFqcGdeQXVyNDUzOTQ5MjY@._V1_.jpg,Raju Srivastava
144,1976-08-20,"Randeep Hooda was born in a small village called Daseya in the Rohtak district of Haryana. His mother, Asha Hooda, is a BJP politician and his father is a surgeon by profession. He did schooling from Delhi Public School before moving to Australia for higher studies. He is Bachelors in Marketing \u0026 Human Resource Management. He made his film debut in...",https://m.media-amazon.com/images/M/MV5BMjk4NjkxNTkxMl5BMl5BanBnXkFtZTgwMzUwNDA3NDE@._V1_.jpg,Randeep Hooda
145,,"Sanjay Mishra is known for his work on Masaan (2015), Dilwale (2015) and Ankhon Dekhi (2013).",https://m.media-amazon.com/images/M/MV5BMTM0OTU2NDYyNl5BMl5BanBnXkFtZTYwNTYyNDgy._V1_.jpg,Sanjay Mishra
146,1950-09-18,"One of the leading lights of the now-largely-defunct Indian New Wave, Shabana Azmi (alongside the late Smita Patil) was one of the main female actors who dominated the films of the so-called \",https://m.media-amazon.com/images/M/MV5BMTQ1NTE0NDgxMl5BMl5BanBnXkFtZTYwNzMyODEz._V1_.jpg,Shabana Azmi
147,1952-09-03,Shakti Kapoor is one of the most comic actors to grace the Bollywood screen. Since the start of his career he has done more than 300 films. He had been often nominated for the Filmfare Award in the most comic performance category. His on-screen pairing with another comic actor Kader Khan as the latter\u0027s son has often led to laughable comedies. ...,https://m.media-amazon.com/images/M/MV5BMTY2MDE1MTQ2N15BMl5BanBnXkFtZTgwNTk2OTczOTE@._V1_.jpg,Shakti Kapoor
148,1970-08-16,"Saif is the son of Bollywood actress, Sharmila Tagore, and Indian cricketer, Mansoor Ali Khan. Both his grandfather, Iftikhar Ali Khan Pataudi, and father were professional cricketers. His mother, Sharmila Tagore, an actress within her own rights. He has two sisters, Bollywood actress Soha Ali Khan, and fashion designer Saba Ali Khan. Saif studied ...",https://m.media-amazon.com/images/M/MV5BMTUyNjI2NTg3M15BMl5BanBnXkFtZTcwNDEzNDg3OA@@._V1_.jpg,Saif Ali Khan
149,1965-11-02,"Shahrukh Khan was born on 2 November 1965 in New Delhi, India. He married Gauri Khan on 25 October 1991. They have three children, son Aryan Khan (b. 1997), son AbRam (b.2013) and daughter Suhana (b. 2000). Khan started out his career by appearing in several television serials during 1988-1990. He made his film debut with the commercially ...",https://m.media-amazon.com/images/M/MV5BZDk1ZmU0NGYtMzQ2Yi00N2NjLTkyNWEtZWE2NTU4NTJiZGUzXkEyXkFqcGdeQXVyMTExNDQ2MTI@._V1_.jpg,Shah Rukh Khan
150,1930-06-06,"Actor, social activist and politician. Sunil Dutt wore many hats and excelled in a plethora of roles that came his way - both on and off screen. Born on June 6th, 1929, Sunil Dutt grew up as Balraj Dutt in a family that had survived the Partition of India. A student of Mumbai\u0027s Jai Hind college, he first started off as radio show host and celebrity ...",https://m.media-amazon.com/images/M/MV5BNzM0OTA3MDAxN15BMl5BanBnXkFtZTgwMzg2OTczOTE@._V1_.jpg,Sunil Dutt
151,1979-04-28,"Sharman Joshi was born on April 28, 1979 in Bombay, Maharashtra, India. He is an actor, known for 3 Idiots (2009), Rang De Basanti (2006) and Golmaal: Fun Unlimited (2006). He has been married to Prerna Chopra since 2000. They have three children.",https://m.media-amazon.com/images/M/MV5BYWE5MWNkYWQtZTZjZS00N2U0LTgzNzMtNzZkMzJmMWYzZWNkXkEyXkFqcGdeQXVyMTExNDQ2MTI@._V1_.jpg,Sharman Joshi
152,1938-03-18,"Shashi Kapoor is one of the leading actors of Indian cinema having appeared in 160 movies - 12 in English and 148 in Hindi. He has appeared in 148 Hindi films - of them played the solo lead hero in 61 films, was lead hero in 53 released multi star cast Hindi films, 2 unreleased multi star film and 21 Hindi films had him in supporting role, worked ...",https://m.media-amazon.com/images/M/MV5BNTcyNDUwNzEzNl5BMl5BanBnXkFtZTgwOTMxMjMzOTE@._V1_.jpg,Shashi Kapoor
153,1955-10-17,"Smita Patil was born on October 17, 1955 in Pune, State of Bombay, India. She was an actress, known for Bhumika (1977), Aaj Ki Awaz (1984) and Mirch Masala (1987). She was married to Raj Babbar. She died on December 13, 1986 in Bombay, Maharashtra, India.",https://m.media-amazon.com/images/M/MV5BMTU3MTUyMjI4OF5BMl5BanBnXkFtZTgwNDgxNzE4MDE@._V1_.jpg,Smita Patil
154,1945-04-19,"Surekha Sikri was born on April 19, 1945 in New Delhi, British India. She is an actress, known for Badhaai ho (2018), Balika Vadhu (2008) and Dev.D (2009).",https://m.media-amazon.com/images/M/MV5BYzI0NGU4NDQtMjZiZS00Mjc2LTk3Y2ItY2NhYmYwOTEyZjQyXkEyXkFqcGdeQXVyNDUzOTQ5MjY@._V1_.jpg,Surekha Sikri
155,1979-04-28,"Sharman Joshi was born on April 28, 1979 in Bombay, Maharashtra, India. He is an actor, known for 3 Idiots (2009), Rang De Basanti (2006) and Golmaal: Fun Unlimited (2006). He has been married to Prerna Chopra since 2000. They have three children.",https://m.media-amazon.com/images/M/MV5BYWE5MWNkYWQtZTZjZS00N2U0LTgzNzMtNzZkMzJmMWYzZWNkXkEyXkFqcGdeQXVyMTExNDQ2MTI@._V1_.jpg,Sharman Joshi
156,,"Born Shashank Sunny Arora in New Delhi, India, on February 21, 1989, Shashank Arora was interested in music and theatre from a young age. After finishing high school in early 2006, he left for Montreal, Canada to study cinema and music. While there, he briefly joined a street theatre group formed by human rights activists. In 2008, he moved to ...",https://m.media-amazon.com/images/M/MV5BMTcxODc3NzkxOF5BMl5BanBnXkFtZTgwMzUwOTU3MTE@._V1_.jpg,Shashank Arora
157,1976-01-27,"Shreyas Talpade was born on January 27, 1976 in Bombay, Maharashtra, India. He is an actor and director, known for Om Shanti Om (2007), Iqbal (2005) and Dor (2006).",https://m.media-amazon.com/images/M/MV5BMjZhOTQzNTEtNGY4NS00ZmQxLThkMDEtM2M4NDVjMjc0MWNlXkEyXkFqcGdeQXVyMTExNDQ2MTI@._V1_.jpg,Shreyas Talpade
158,,"Shernaz Patel is an actress, known for Black (2005), Guzaarish (2010) and Talaash (2012).",https://m.media-amazon.com/images/M/MV5BNTBjN2U2MTgtZjhhMC00YjE4LWI5ODQtN2EwYmJhNTU4MDdkXkEyXkFqcGdeQXVyMTExNDQ2MTI@._V1_.jpg,Shernaz Patel
159,1965-01-14,"Seema Biswas was born on January 14, 1965 in Nalbari, Assam, India. She is an actress, known for Bandit Queen (1994), Water (2005) and Company (2002).",https://m.media-amazon.com/images/M/MV5BMTczMTgyOTkyOV5BMl5BanBnXkFtZTYwNTQ1MDA0._V1_.jpg,Seema Biswas
160,1965-03-14,"Sachin Khedekar was born on March 14, 1965 in Mumbai, Maharahstra, India. He is known for his work on 13B: Fear Has a New Address (2009), Netaji Subhas Chandra Bose: The Forgotten Hero (2005) and Maattrraan (2012). He has been married to Jalpa Khedekar since December 19, 1993. They have two children.",https://m.media-amazon.com/images/M/MV5BOThiMjlmYzYtNmQ3NC00YzUyLWE4MmUtMjEzMWQxNjMyZmVlXkEyXkFqcGdeQXVyMTExNDQ2MTI@._V1_.jpg,Sachin Khedekar
161,1957-10-19,Ajay Singh Deol popularly known as Sunny Deol was born to actor Dharmendra and Prakash Kaur. Sunny began acting with super hit film Betaab (1983) which was a love story also featuring another new comer Amrita Singh; this film was a major success and then he goes on making films which portrayed him as Bollywood\u0027s best action hero. There is Arjun (...,https://m.media-amazon.com/images/M/MV5BMjEwOTA2MjMwMl5BMl5BanBnXkFtZTcwODc3MDgxOA@@._V1_.jpg,Sunny Deol
162,,"Sudesh Lehri is an actor, known for Jai Ho (2014), Ready (2011) and Dard Pardesaan De (2000).",https://m.media-amazon.com/images/M/MV5BNjVhOGZjYzEtM2Y3MS00OTAyLTg5Y2QtZTQzMDVkZWQyYTI2L2ltYWdlXkEyXkFqcGdeQXVyMTExNDQ2MTI@._V1_.jpg,Sudesh Lehri
163,1935-01-19,"Soumitra Chatterjee was born on January 19, 1935 in Krishnanagar, Bengal Presidency, British India as Soumitra Chattapadhaya. He is an actor, known for Apur Sansar (1959), Aranyer Din Ratri (1970) and Podokkhep (2006). He is married to Deepa Chatterjee.",https://m.media-amazon.com/images/M/MV5BMjI5Mjk4NDc3Ml5BMl5BanBnXkFtZTgwMjczMTI1NTE@._V1_.jpg,Soumitra Chatterjee
164,1929-01-08,"Saeed Jaffrey was born in Maler Kotla, Punjab, India. He was born on the 8th of January 1929. He attended University of Allahabad where he completed his post-graduate degree in history. He also attended the Staff Training Institute of All India Radio. He started his career in drama, as the founder of his own English theatre company called the ...",https://m.media-amazon.com/images/M/MV5BMTU4NTAzNTIxMl5BMl5BanBnXkFtZTcwMjkyNzg5Nw@@._V1_.jpg,Saeed Jaffrey
165,1928-10-01,"Tamil superstar from a poor family in Tamil Nadu, India. His father worked on the railways. On the day of his birth his father, Chiniah Pillai, follower of Mahatma Gandhi, was jailed for participating in the Independence movement in Nellikuppam (Tamil Nadu, India). He was frequently in and out of jail, and was raised by his mother, Rajamani Ammal. ...",https://m.media-amazon.com/images/M/MV5BMmI2Nzk4NWQtOTAxNi00ZTIxLTljNDktZDJlZDQ2NDRiODJjXkEyXkFqcGdeQXVyMjYwMDk5NjE@._V1_.jpg,Shivaji Ganesan
166,1946-12-08,"A Bengali actress who achieved success young, Sharmila appeared in numerous Bengali classics before making the jump to Hindi cinema, which first made her a romantic actress and later a legendary actress thanks to her intense films opposite Superstar Rajesh Khanna. A distant relative of poet Rabindranath Tagore, she is also the wife of His Highness...",https://m.media-amazon.com/images/M/MV5BMTg4Njc5MzUzNF5BMl5BanBnXkFtZTgwOTYzMTI1NTE@._V1_.jpg,Sharmila Tagore
167,,"Sheeba Chaddha was born in 1972 in Delhi, India. She is an actress, known for Talaash (2012), Dil Se.. (1998) and Gully Boy (2019).",https://m.media-amazon.com/images/M/MV5BNzc0NWJjMjQtM2VhOC00MDAxLWE5ZjItZTNlZDFkYjE1YjE0XkEyXkFqcGdeQXVyNDUzOTQ5MjY@._V1_.jpg,Sheeba Chaddha
168,1963-08-13,"Sridevi was born on August 13, 1963 in her father\u0027s hometown of Sivakasi, Tamil Nadu, India. Her mother was from Tirupati, Andhra Pradesh. So Sridevi grew up speaking Telugu and Tamil. She has a sister named Srilatha and a stepbrother named Satish. Her dad passed away during the year 1991, while her mom died during 1997. She started her career at a...",https://m.media-amazon.com/images/M/MV5BMTQyMjg4Mzk2M15BMl5BanBnXkFtZTcwMjE0MTg2OA@@._V1_.jpg,Sridevi
169,1965-12-27,"Born on December 27, 1965 Salman Khan is the son of the legendary writer Salim Khan, who penned many super-hits in the yesteryear\u0027s like Sholay (1975), Deewaar (1975), and Don (1978). Salman started his acting carrier in 1988 by doing a supporting role in the movie Biwi Ho To Aisi (1988). The following year he had the leading role in the box ...",https://m.media-amazon.com/images/M/MV5BMjMwNTIxODg0OF5BMl5BanBnXkFtZTgwODg2NzM0OTE@._V1_.jpg,Salman Khan
170,1963-03-05,"Shukla\u0027s family left Gorakhpur for Delhi when he was two years old. After completing his schooling, he graduated from Khalsa College, Delhi. His professional career began in 1984 with his entry into theater. Shukla began serious theater in 1986 with roles in plays like A View From The Bridge (Arthur Miller), Look Back In Anger (John Osborne), ...",https://m.media-amazon.com/images/M/MV5BMTYzMTczOTM2Ml5BMl5BanBnXkFtZTYwNzE4Mzgy._V1_.jpg,Saurabh Shukla
171,1959-07-29,"Sanjay Dutt, son of Nargis and Sunil Dutt, was first featured in Rocky (1981), the movie was a box office hit. Sanjay\u0027s personal life was exacerbated by drug problems, and he later lost his wife Richa Sharma, to cancer. He was also arrested for having illegal weapons, and was imprisoned. After his release, he appeared in three consecutive hits; ...",https://m.media-amazon.com/images/M/MV5BNzU2NTgwNzY1OF5BMl5BanBnXkFtZTcwMjQxNzcxOA@@._V1_.jpg,Sanjay Dutt
172,1938-07-09,Harihar Jariwala a.k.a. Sanjeev Kumar was born in a Gujrati family in 1938. He portrayed many roles irrespective of the age or the type of chararcter. The actor ballooned in size in later years of his life due to the gastronomical pleasures he had inherited by sleeping in a kitchen while he was a child (which became the cause of his death in 1985 ...,https://m.media-amazon.com/images/M/MV5BZmE5YTIwODYtMTA2OC00ZDg1LTk3NmItMGI1NzhjNTZiNjIyXkEyXkFqcGdeQXVyMTExNDQ2MTI@._V1_.jpg,Sanjeev Kumar
173,1973-09-02,"Sudeep is an Indian film actor, director, producer, screenwriter, playback singer, anchor, and cricketer who works primarily in Kannada cinema. He won the Filmfare Award for Best Actor - Kannada for three consecutive years for his films Huchcha (2001), Nandhi (2002) and Swathi Muthu (2003). Since 2013, he is hosting the television reality show ...",https://m.media-amazon.com/images/M/MV5BOWFjZGYxZDMtYTBhYy00YWVkLTk2NDUtMmE2NTAyM2Q0OTMyXkEyXkFqcGdeQXVyMjYwMDk5NjE@._V1_.jpg,Sudeep
174,1961-08-11,"Sunil Shetty made his debut in 1992 with Balwaan (1992), which was not a major hit. Yet his great acting skills got noticed. For two years success eluded him until action thriller Mohra (1994) came along in 1994. Then followed his success streak with a comical film Gopi Kishan (1994) in which he played a dual role. The movie became a blockbuster ...",https://m.media-amazon.com/images/M/MV5BODUwMzUyNTUxMl5BMl5BanBnXkFtZTcwNDM2ODIyOA@@._V1_.jpg,Sunil Shetty
175,1990-03-02,"Tiger Shroff was born on March 2, 1990 in Mumbai, India as Jai Hemant Shroff. He is an actor, known for Heropanti (2014), A Flying Jatt (2016) and Baaghi (2016).",https://m.media-amazon.com/images/M/MV5BNjUyMTQyNDA2M15BMl5BanBnXkFtZTgwNDI4ODEzOTE@._V1_.jpg,Tiger Shroff
176,1950-06-22,"Tom Alter, the son and grandson of American Presbyterian missionaries who first came to India in 1916, grew up in north India in the towns of Rajpur and Mussoorie, and studied at Woodstock School. It was while teaching at a school in Jagadhri, Haryana in the early 1970s that Alter picked honed his Hindi and fell in love with the movies, in specific...",https://m.media-amazon.com/images/M/MV5BMjk1NDI0ZjEtMDMwOS00ZTY5LTk3NTEtODYxZWZlNTE4OTZmXkEyXkFqcGdeQXVyMTExNDQ2MTI@._V1_.jpg,Tom Alter
177,1953-05-04,"Tinnu Anand is an Indian actor and director from Bollywood, who is most known as the director of Amitabh Bachchan\u0027s movies including, Kaalia (1981), Shahenshah (1988), Main Azaad Hoon (1989) and Major Saab (1998).He is the son of veteran writer Inder Raj Anand and uncle of director Siddharth Anand. Anand recently portrayed an important role in ...",https://m.media-amazon.com/images/M/MV5BZjM4OWEyOWItNmU0Yy00MjQyLTkyNzYtOTQzNzA1ZTJmOTY0XkEyXkFqcGdeQXVyMTExNDQ2MTI@._V1_.jpg,Tinnu Anand
178,1970-11-04,"Tabu is an Indian actress. She has mainly acted in Hindi films, though she has also starred in Telugu, Tamil, Malayalam, Marathi and Bengali-language films, as well as one American film. She has won the National Film Award for Best Actress twice, and holds the record for the most wins of Filmfare\u0027s Critics Award for Best Female Performer, with ...",https://m.media-amazon.com/images/M/MV5BMTU0ODQ2MjA5NF5BMl5BanBnXkFtZTYwMjczMjA0._V1_.jpg,Tabu
179,,"Tigmanshu Dhulia is a director and actor, known for Gangs of Wasseypur (2012), Paan Singh Tomar (2012) and Saheb Biwi Aur Gangster (2011).",https://m.media-amazon.com/images/M/MV5BMmVkZTMxMTgtNjk3Ny00Yzc4LWFhZWYtMjBhYTJjN2EwMDViXkEyXkFqcGdeQXVyMTExNDQ2MTI@._V1_.jpg,Tigmanshu Dhulia
180,,"Usha Nadkarni is an actress, known for Rustom (2016), Pavitra Rishta (2009) and Vaastav: The Reality (1999).",https://m.media-amazon.com/images/M/MV5BNDRiOGQ0YWYtNmE0MC00NWM4LTg5YTMtNzAyNjQyZGVkOThjXkEyXkFqcGdeQXVyMTExNDQ2MTI@._V1_.jpg,Usha Nadkarni
181,1975-06-29,"Upasna Singh was born on June 29, 1975 in Kapurthala, Punjab, India. She is an actress, known for Jatt \u0026amp; Juliet (2012), Disco Singh (2014) and Wattanaan Ton Door (2008). She has been married to Neeraj Bhardwaj since 2012.",https://m.media-amazon.com/images/M/MV5BYzkzNGJjNGMtMTcyMy00YmQ5LTgwMmItNzk4MjBkZWJhMTg1XkEyXkFqcGdeQXVyNDUzOTQ5MjY@._V1_.jpg,Upasna Singh
