,Birthdate,Description,Image,Name
0,1965-03-14,Aamir is no doubt one of the most dedicated actors in this world. With his recent success in India and China markets combined he has got the title of World\u0027s Biggest Superstar. He went through rapid transformations in his body structure for his films to bring out the reality factor in his characters. This is also one of the reasons why his films ...,https://m.media-amazon.com/images/M/MV5BMjAwMjk3NDUzN15BMl5BanBnXkFtZTcwNjI4MTY0NA@@._V1_.jpg,Aamir Khan
1,1967-09-09,"Akshay Kumar, born September 9, 1967, is an actor. He studied martial arts in Hong Kong. It was a student that suggested that he try modeling. Because of his success as model, he was offered films. Along with his good looks and excellent martial art skills, he was always the first choice to do adventurous movies. He does his own stunts in his ...",https://m.media-amazon.com/images/M/MV5BODI4NDY1NzkyM15BMl5BanBnXkFtZTgwNzM3MDM0OTE@._V1_.jpg,Akshay Kumar
2,1969-04-02,"Ajay Devgn is an Indian film actor, director, and producer. He made his film debut with Phool Aur Kaante in 1991 and received a Filmfare Award for Best Male Debut for his performance in the film. He then starred in films such as Jigar (1992), Dilwale (1994), Suhaag (1994), Naajayaz (1995), Diljale (1996) and Ishq (1997). In 1999, Devgn received his...",https://m.media-amazon.com/images/M/MV5BMTY0MDY2MDMwOV5BMl5BanBnXkFtZTgwNDE4MDM0OTE@._V1_.jpg,Ajay Devgn
3,1940-11-12,"Amjad Khan was born on November 12, 1940 in Hyderabad, Hyderabad State, British India. He was an actor and director, known for Sholay (1975), Yaarana (1981) and Maa Kasam (1985). He was married to Shaila Khan. He died on July 27, 1992 in Bombay, Maharashtra, India.",https://m.media-amazon.com/images/M/MV5BOWUzNjU3YTUtOGIyMi00MDk3LTk1NDMtMzY4MDZlNDFhNTFhXkEyXkFqcGdeQXVyMTExNDQ2MTI@._V1_.jpg,Amjad Khan
4,1942-10-11,"Son of well known poet Harivansh Rai Bachchan and Teji Bachchan. He has a brother named Ajitabh. He completed his education from Uttar Pradesh and moved to Bombay to find work as a film star, in vain though, as film-makers preferred someone with a fairer skin, and he was not quite fair enough. But they did use one of his other assets, his deep ...",https://m.media-amazon.com/images/M/MV5BNTk1OTUxMzIzMV5BMl5BanBnXkFtZTcwMzMxMjI0Nw@@._V1_.jpg,Amitabh Bachchan
5,1944-11-24,"Amol Palekar was born on November 24, 1944 in Bombay, Bombay Presidency, British India. He is an actor and director, known for Kairee (1999), Bangarwadi (1995) and Gol Maal (1979).",https://m.media-amazon.com/images/M/MV5BNzZhNDQ1YzItNTVlOC00MmVmLTkzMjEtMDFmN2Q0MDU2YmQ3XkEyXkFqcGdeQXVyMTExNDQ2MTI@._V1_.jpg,Amol Palekar
6,1976-03-15,"Abhay Deol (born in 1976, India) is an Indian film actor. He is the nephew of famous veteran actor Dharmendra and cousin of actors Sunny Deol and Bobby Deol and actress Esha Deol. After graduating from Mumbai University, Abhay headed to Los Angeles and studied Fine Arts. After completing a two year acting course, Abhay answered to his Bollywood ...",https://m.media-amazon.com/images/M/MV5BMTU2NzkzODA3OV5BMl5BanBnXkFtZTcwMzk2MDMyOA@@._V1_.jpg,Abhay Deol
7,1975-03-28,"Akshaye Khanna was born in Mumbai in 1975. He is the middle son of Bollywood actor and politician Vinod Khanna, and the younger brother of actor Rahul Khanna. After studying in Kishore Namit Kapoor Acting Institute in Mumbai, Khanna made his acting debut in Bollywood in 1997 with the movie Himalay Putra, which went without much success at box ...",https://m.media-amazon.com/images/M/MV5BMjAxNDQyNDkxM15BMl5BanBnXkFtZTcwNTQyNTA0MQ@@._V1_.jpg,Akshaye Khanna
8,1968-04-19,"Arshad Warsi was born in Mumbai, India, and did his schooling at a boarding school, Barnes School, Deolali in Nashik district, Maharashtra. He was orphaned at the age of 14 and struggled for a living in Mumbai during his early days. Financial circumstances forced Warsi to start work as a door-to-door cosmetics salesman at age 17. Later he worked in...",https://m.media-amazon.com/images/M/MV5BNmMwOGYwMjUtN2M5My00ODIxLWI3ZjctODM2MGI4OGQzOWM0XkEyXkFqcGdeQXVyMTExNDQ2MTI@._V1_.jpg,Arshad Warsi
9,1981-11-07,Anushka Shetty is an Indian Film Actress. She was also a Yoga Instructor and has trained under yoga guru Bharat Thakur. This tall and gorgeous beauty debuted in the 2005 Telugu film Super starring Nagarjuna which was super hit at box office. Later her performance in Vikramarkudu make her noticeable. But in Arundhati in which she had played the role...,https://m.media-amazon.com/images/M/MV5BZTkxYmU1NmUtNGE4Ni00OWNmLWE5YzktNTJiZTlmMTIyMTM5XkEyXkFqcGdeQXVyMTExNDQ2MTI@._V1_.jpg,Anushka Shetty
10,1965-09-10,"Atul Kulkarni was born on September 10, 1965 in Karnataka, India. He is an actor, known for Rang De Basanti (2006), Hey Ram (2000) and Page 3 (2005).",https://m.media-amazon.com/images/M/MV5BY2E1ODI1MGUtYWY1ZS00ZDdlLTg0ZDctNWU1NmJhM2UxYzU5XkEyXkFqcGdeQXVyMjkxNzQ1NDI@._V1_.jpg,Atul Kulkarni
11,1941-01-01,Asrani was born in a middle class Sindhi family. His father migrated to Jaipur after the Partition of India and opened a shop selling carpets. He has four sisters and three brothers: two elder and one younger. Asrani was highly uninterested in business and very weak in mathematics. He completed his matriculation from St. Xaviers School and did his...,https://m.media-amazon.com/images/M/MV5BMjEyNDQ4MzUzNF5BMl5BanBnXkFtZTgwNjY3OTczOTE@._V1_.jpg,Asrani
12,1984-09-14,"Ayushmann Khurrana was born on 14 September 1984 in Chandigarh, India. Ayushmann started off his career as a popular radio jockey, and eventually became a VJ on MTV India and one of the most popular hosts in India. He shot to stardom with the runaway hit, \u0027Vicky Donor\u0027 in 2012. His effortless act in his debut won him rave reviews and the film went...",https://m.media-amazon.com/images/M/MV5BOTk4MDY4ODAwNl5BMl5BanBnXkFtZTcwNzQ0MjY2Nw@@._V1_.jpg,Ayushmann Khurrana
13,1946-08-18,"Aruna Irani made her debut in the movie Gunga Jumna (1961) at nine years old playing Azra\u0027s character. After doing several small roles in films like Jahanara (1964), Farz (1967), Upkar (1967) and Aaya Sawan Jhoomke (1969). She was paired with comedian Mehmood Ali in films like Aulad (1968), Jawab, Humjoli (1970), Manmandir and Naya Zamana (1971)....",https://m.media-amazon.com/images/M/MV5BYWIzYjZkZTAtNDM0MS00YjBiLWJlMjItZDY1YTJhNjMxNTExXkEyXkFqcGdeQXVyNDUzOTQ5MjY@._V1_.jpg,Aruna Irani
14,1956-02-20,"Annu Kapoor made his debut in the film Mandi directed by Shyam Benegal in 1983.His career has spanned nearly 30 years including a distinctive presence in Bollywood cinema, television serials, and reality game shows. He is best remembered for hosting the singing show Antakshari, produced by ZEE TV. His performance as an obsessive-compulsive Sperm ...",https://m.media-amazon.com/images/M/MV5BMjE4MjAxODk1NV5BMl5BanBnXkFtZTcwODQ0MjY2Nw@@._V1_.jpg,Annu Kapoor
15,1962-06-19,"Ashish Vidyarthi was born on June 19, 1962 in Tellicherry, Kerala, India. He is an actor, known for 24 (2013), Haider (2014) and Pokiri (2006).",https://m.media-amazon.com/images/M/MV5BMzk5Mzc5Y2YtYjJjYy00OGIyLTg4MzctZTMxNDBiYzY2MTcxXkEyXkFqcGdeQXVyNjc0MTQwOTc@._V1_.jpg,Ashish Vidyarthi
16,,"Adil Hussain is known for his critically acclaimed performances in award winning films such as Ang Lee\u0027s Oscar winning Life of Pi, Subhashish Bhutiani\u0027s Hotel Salvation/Mukti Bhavan, Iram Haq\u0027s What Will People Say, Danis Tanovic\u0027s Tigers, Mira Nair\u0027s The Reluctant Fundamentalist, Pan Nalin\u0027s Angry Indian Goddesses, Partho Sen-Gupta\u0027s Sunrise, ...",https://m.media-amazon.com/images/M/MV5BN2Q2YzA4MDMtMzVkYy00ZTMwLTgzN2EtZTc4NTRiODhkNzM3XkEyXkFqcGdeQXVyMjA4ODEzMzE@._V1_.jpg,Adil Hussain
17,1955-03-07,"Anupam Kher was born on March 7, 1955 in Shimla, Himachal Pradesh, India. He is an actor and producer, known for Silver Linings Playbook (2012), A Wednesday (2008) and M.S. Dhoni: The Untold Stor (2016).",https://m.media-amazon.com/images/M/MV5BMjMyMjc1OTgzNF5BMl5BanBnXkFtZTgwMDY1NDMzOTE@._V1_.jpg,Anupam Kher
18,1956-12-24,"Living in a Chawl in Tilak Nagar, Punjabi-speaking Anil was born in 1959 to Surinder and Nirmal aka Suchitra Kapoor. He has an elder brother, Boney, a sister, Reena, and a younger brother, Sanjay. His dad used to be Shammi Kapoor\u0027s Secretary. A loner, without many friends, he studied in the nearby O.L.P.S. (Our Lady of Perpetual Succor) School, and...",https://m.media-amazon.com/images/M/MV5BMjUyMWE5MjUtMDlkMC00ODc0LThkOTgtNjZhNDgyMTU5ZDhlXkEyXkFqcGdeQXVyMTExNDQ2MTI@._V1_.jpg,Anil Kapoor
19,1932-06-22,"Believe it or not, Amrish Puri wanted to become a Bollywood movie hero but failed a screen test in 1954. And what a failure it was! Mr. Puri went on to become one of the most renowned and credible villains in the history of Indian cinema. His most memorable and often quoted role is the character of \u0027Mogambo\u0027 (with the catchphrase \",https://m.media-amazon.com/images/M/MV5BYWRlMTk2NWYtYjhjNy00NmRjLTg4NWMtMmM2YjJlN2YwNWE4XkEyXkFqcGdeQXVyMTExNDQ2MTI@._V1_.jpg,Amrish Puri
20,,"Amole Gupte is an Indian screenwriter, actor, and director, known for his work on Bollywood films like Taare Zameen Par (Like Stars on Earth), Stanley ka dabba, Kaminey and others. He is also an actor in Bheja Fry 2 (2011), stanley Ka Dabba (2011),Urumi (2011) Phas gaye re obama (2010) and Kaminey.",https://m.media-amazon.com/images/M/MV5BZmNhMWQyOGYtYmZkMy00ZjdjLWE4N2QtYjc0NzEyZjViZWQzXkEyXkFqcGdeQXVyMTExNDQ2MTI@._V1_.jpg,Amole Gupte
21,1959-12-02,"Boman Irani was born on December 2, 1959 in Bombay, State of Bombay, India. He is an actor, known for 3 Idiots (2009), Munna Bhai M.B.B.S. (2003) and Don 2 (2011). He has been married to Zenobia since January 28, 1985. They have two children.",https://m.media-amazon.com/images/M/MV5BNTc4ZjFlMjUtODU3MS00M2JhLTlkMzEtMmIyODFiMjAwZmJhXkEyXkFqcGdeQXVyNTE0MDc0NTM@._V1_.jpg,Boman Irani
22,1913-05-01,"Balraj Sahni was born on May 1, 1913 in Rawalpindi, Punjab, British India. He was an actor, known for Baazi (1951), Kabuliwala (1961) and Bhabhi (1957). He was married to Santosh Chandhok and Damayanti Sahni. He died on April 13, 1973 in Bombay, Maharashtra, India.",https://m.media-amazon.com/images/M/MV5BZDgwMGMzMWUtMmQ1Yi00NjM0LTlkMDgtMTk5MmFkMWJhNDY1XkEyXkFqcGdeQXVyMTExNDQ2MTI@._V1_.jpg,Balraj Sahni
23,,"Binnu Dhillon is an actor and producer, known for Dev.D (2009), Vadhayiyaan Ji Vadhayiyaan (2018) and Chhevan Dariya (The Sixth River) (2010).",,Binnu Dhillon
24,1920-06-14,"Bharat Bhushan was born on June 14, 1920 in Meerut, United Provinces of Agra and Oudh, British India. He was an actor, known for Gateway of India (1957), Mirza Ghalib (1954) and Shri Chaitanya Mahaprabhu (1954). He died on January 27, 1992 in Bombay, Maharashtra, India.",https://m.media-amazon.com/images/M/MV5BODIwNGY2OGItN2I4Ny00Y2ExLWEzZmQtMTI0M2IxMWQxYTU5XkEyXkFqcGdeQXVyNDUzOTQ5MjY@._V1_.jpg,Bharat Bhushan
25,1955-08-22,"This Telugu Star was a student at the Madras Film Institute and an amateur stage actor. His first public performance was in the Republic Day parade ballet of Andra Pradesh on 26 January, 1976. His film debut was Punadhirallu (1978). His brother-in-law is producer Allu Aravind. His success started with Initilo Ramayya Vidhilo Krishnayya (1981). He ...",https://m.media-amazon.com/images/M/MV5BOGQ4MTc3MWYtNmUxNi00Nzk3LWFjMDItM2Y1NmVmMDEyNWIxXkEyXkFqcGdeQXVyMTExNDQ2MTI@._V1_.jpg,Chiranjeevi
26,1962-09-26,"Chunky Pandey was born in Bombay, India on September 26, 1962 in a non-film household. Chunky\u0027s real name is Suyash Sharad Pandey, but is also known as Chandrakant Pandey. He shot into fame with a secondary role in \u0027Tezaab\u0027 which had Anil Kapoor and Madhuri Dixit in the lead roles. He continued to meet considerable success in secondary and ...",https://m.media-amazon.com/images/M/MV5BMTk5NjI3MTEwNF5BMl5BanBnXkFtZTgwMzU2MTMzOTE@._V1_.jpg,Chunky Pandey
27,1948-02-25,"Danny, who married Gawa Denzongpa, a Sikkimese princess and niece of the last chogyal from her hometown of Gangtok, currently resides in Juhu in Mumbai. He likes to listen to Nepali folk music especially Nepali flutes. In recent times he has become more selective as to the roles he plays. He does not work in March, April, and May as they are hot. ...",https://m.media-amazon.com/images/M/MV5BMzI4Njg3OTcyNF5BMl5BanBnXkFtZTcwNzQzMTYxOA@@._V1_.jpg,Danny Denzongpa
28,1996-03-09,"Born in the same city and on the same month as his family friend Aamir Khan, Darsheel Safary (born March 9, 1997 in Mumbai, India) is an Indian child movie actor primarily working on starring in Hindi Bollywood films. He is best known for his acclaimed portrayal of a dyslexic child in the 2007 film Taare Zameen Par (Like Stars on Earth), a drama ...",https://m.media-amazon.com/images/M/MV5BMjYyYzViMmYtMjU4Yi00NGM3LWFjZTEtZmFkOGFmOTllY2I2XkEyXkFqcGdeQXVyMTExNDQ2MTI@._V1_.jpg,Darsheel Safary
29,1961-08-28,"Deepak Tijori was born on August 28, 1961 in Bombay, Maharashtra, India. He is an actor and director, known for Fox (2009), Do Lafzon Ki Kahani (2016) and Tipsy (2020).",https://m.media-amazon.com/images/M/MV5BNmIwYzhiNjUtYmY3NS00YjdhLTlkM2UtZDJhZDJiNDkzNDI5XkEyXkFqcGdeQXVyNDY2Nzg2NQ@@._V1_.jpg,Deepak Tijori
30,1935-12-08,"Dharmendra is one of the biggest stars of Indian cinema. Dharmendra Deol played the romantic hero in woman centric films from 1960-1968 and became romantic hero from 1968-69 and played the role of action hero from 1971-1997. Dharmendra has appeared in 306 films. He is known as \u0027Garam\u0027 Dharam in Bollywood. Had the looks of a real gentle man, ...",https://m.media-amazon.com/images/M/MV5BMTk0ODU5NjAzMl5BMl5BanBnXkFtZTcwNDYyOTM5NA@@._V1_.jpg,Dharmendra
31,1986-01-05,"Deepika Padukone, born 5 January 1986 in Copenhagen, Denmark, is an Indian model \u0026 Actress. She is the daughter of former badminton Champion Prakash Padukone. Her mother tongue is Konkani. Deepika has a younger sister named Anisha. She has been modeling appearances in print and television advertising campaigns for Liril, Close-Up toothpaste and ...",https://m.media-amazon.com/images/M/MV5BNGFlYzAyYjgtNzRjNS00NmE4LTliOGYtYzBkYzU5MzRhMDM0XkEyXkFqcGdeQXVyMTExNDQ2MTI@._V1_.jpg,Deepika Padukone
32,1957-06-08,"Born in a Gujerati-speaking family on June 8, 1957, daughter to businessman, Chunnibhai and Betty, Dimple has a younger sister, Simple, who was born on 15 August 1958. She was discovered by Raj Kapoor, who signed her up opposite his son, Rishi, in the 1973 hit \u0027Bobby\u0027. The film made Rishi and her stars overnight, at the time she was just 16 years ...",https://m.media-amazon.com/images/M/MV5BNTc4MTE1NDU5MF5BMl5BanBnXkFtZTcwNDI2MTcxOA@@._V1_.jpg,Dimple Kapadia
33,1923-09-26,"After having played the Lead Actor for more than five decades in over 110 motion pictures, Dev Anand continues to bestride Indian Cinema today. He has given a new dimension to that magical state known as Stardom. And for his exemplary work he was awarded the Padma Bhushan in 2001 by the President of India. From the time he embarked on his career ...",https://m.media-amazon.com/images/M/MV5BMTk5MDI0OTQzOF5BMl5BanBnXkFtZTcwMTgwMzEzMQ@@._V1_.jpg,Dev Anand
34,1952-02-03,"Deepti Naval is an Indian film actor, director, writer, painter and photographer. A multi-faceted personality, her major contribution has been in the area of art cinema, winning critical acclaim for her sensitive and close to life characters that emphasized the changing role of women in India. The first American-Indian actor to join Hindi films, ...",https://m.media-amazon.com/images/M/MV5BYjhjNWM1MmUtM2M3My00MWZmLWE5NDYtNTI5YTM3MWQwNGVhXkEyXkFqcGdeQXVyNDUzOTQ5MjY@._V1_.jpg,Deepti Naval
35,1922-12-11,"Dilip Kumar is considered to be one of the greatest actors of Indian cinema. Starting his career in 1944, he has starred in some of the biggest commercially successful films in the period 1949-1961. . He was the first actor to receive a Filmfare Best Actor Award and holds the record for most number of Filmfare Awards won for that category. Though ...",https://m.media-amazon.com/images/M/MV5BMzg0NTM0MjYxN15BMl5BanBnXkFtZTcwMzY1NTAzMQ@@._V1_.jpg,Dilip Kumar
36,1948-03-25,"Farooq Sheikh was an Indian actor, philanthropist and a television presenter. He was known for his work in Hindi films from 1977 to 1989. He returned to acting in films in 2008. His major contribution was in Parallel Cinema or the New Indian Cinema. He\u0027s acted in serials and shows on television and has performed on stage in famous productions like...",https://m.media-amazon.com/images/M/MV5BNzY3ODZmNDctZDA0ZC00NGNmLTgzZmItM2JhMTI4MzM3NTU2XkEyXkFqcGdeQXVyMTExNDQ2MTI@._V1_.jpg,Farooq Shaikh
37,1974-01-09,"An accomplished and award-winning producer-director-writer-actor-singer, Farhan Akhtar is the ultimate Bollywood multi-hyphenate. Born in 1974 to prolific Indian film writer and poet, Javed Akhtar and writer-director, Honey Irani , Farhan was raised in an environment where creativity and originality of thought were encouraged. This has made him a ...",https://m.media-amazon.com/images/M/MV5BMjA4MjYwNzAzM15BMl5BanBnXkFtZTcwMzUyMTUxNw@@._V1_.jpg,Farhan Akhtar
38,1939-09-25,"Firoz was born in Bangalore on September 25, 1939 to a Pathan father, Sadiq, and an Iranian mother, Fatima. He has three brothers, Abbas alias Sanjay, Akbar, and Sameer. Both Sanjay and Akbar are actors within their own rights, while Sameer is a film-maker and assists in their Golden Palms Spa located in Bangalore. He made his entry on the silver ...",https://m.media-amazon.com/images/M/MV5BN2NjODM2NDItYTU0Ni00MzJmLWJkZTYtMjQ3ZDZjZmNjY2NhXkEyXkFqcGdeQXVyMTExNDQ2MTI@._V1_.jpg,Feroz Khan
39,1949-03-14,"Farida Jalal was discovered by Filmfare\u0027s United Producers\u0027 Talent Hunt in the 1960s. She starred in her first movie as a teenager, in the Rajshri Productions\u0027 \",https://m.media-amazon.com/images/M/MV5BZGE2OTUzZDEtZWQ2Ny00YTQ0LWEyYmItYmRiYjMxNTFiYzYwXkEyXkFqcGdeQXVyNDUzOTQ5MjY@._V1_.jpg,Farida Jalal
40,1925-07-09,"Considered to be a man ahead of his time, Guru Dutt was one of the greatest icons of commercial Indian cinema. Although he made less than fifty films, they are believed to be the best to come from Bollywood\u0027s Golden Age, known both for their ability to reach out to the common man and for their artistic and lyrical content, and they went on to ...",https://m.media-amazon.com/images/M/MV5BMjA0Mzg2NjEwN15BMl5BanBnXkFtZTgwODQ1NDQzNzE@._V1_.jpg,Guru Dutt
41,1963-12-21,"Govinda was born on December 21, 1963. Govinda has acted in over 120 films since his debut in 1986. Govinda is best-known for his comedy related roles; his powerful contribution in dancing in bollywood is inevitable. He is one of the most successful actors and is definitely the best dancer in bollywood. His hardworking mentality and consistent ...",https://m.media-amazon.com/images/M/MV5BNzEwNDgwMTk3Nl5BMl5BanBnXkFtZTgwNjMwOTU4MDI@._V1_.jpg,Govinda
42,1955-09-21,"Gulshan Grover was born, raised and educated in Delhi, India. After receiving his master\u0027s degree in Commerce from Shri Ram College of Commerce, he decided to pursue his passion and made a lifelong commitment to entertainment industry. He honed his acting skills in theatre, and after many stage productions with the well-known \",https://m.media-amazon.com/images/M/MV5BM2FmZGY4NDctMzczOC00MTg3LWExZDUtYWU5NTNkMTA4YzZhXkEyXkFqcGdeQXVyODI0MDE3OQ@@._V1_.jpg,Gulshan Grover
43,,"Gurpreet Ghuggi was born as Gurpreet Singh. He is known for his work on Race (2008), Singh Is Kinng (2008) and Nalaik (2005). He is married to Kuljeet Kaur. They have two children.",https://m.media-amazon.com/images/M/MV5BODJhZWQ3NGEtZDFmYS00YTc3LTllMzctZGFlM2U0NjliYTczXkEyXkFqcGdeQXVyMTExNDQ2MTI@._V1_.jpg,Gurpreet Ghuggi
44,1938-05-19,"Girish Karnad was born on 19th May 1938 in Matheran, Maharashtra. He is acclaimed for his contemporary playwrights in Kannada. He is also an actor, director and screen writer. He was conferred Padma Shri and Padma Bhushan by the Government of India and won four Filmfare Awards where three are Filmfare Award for Best Director - Kannada and one ...",https://m.media-amazon.com/images/M/MV5BMTkyNDk3MjEzN15BMl5BanBnXkFtZTYwOTQyODEz._V1_.jpg,Girish Karnad
45,1974-01-10,"Hrithik Roshan is an Indian actor, born on 10th January 1974, well known globally for his versatile roles, unmatchable dancing skills and attractive looks. After having appeared in films as a child actor in the 1980s, Roshan made his film debut in a leading role in Kaho Naa... Pyaar Hai (2000) for which he earned Filmfare Awards for Best Actor and ...",https://m.media-amazon.com/images/M/MV5BZjYwYjE4YjQtMTFmMi00NTlhLThjZjUtZTIyMTczMGU2ZDE5XkEyXkFqcGdeQXVyNzM2NzM0NDU@._V1_.jpg,Hrithik Roshan
46,1986-07-28,"Huma Qureshi born and raised in Delhi. Her father is a famous restaurant owner called Saleem\u0027s a chain of some 10 restaurants in Delhi. Her brother, Saqib Saleem is an actor and acted in Mujhse Fraaandship Karoge. In year 2011 an announcement was made that Huma would make her Bollywood debut in a movie too called Billa 2 but got delayed due to ...",https://m.media-amazon.com/images/M/MV5BMTEwMTkyMDY3OTheQTJeQWpwZ15BbWU4MDE1MjEyMzkx._V1_.jpg,Huma Qureshi
47,1979-11-14,"An alumnus of National School of Drama, Inaamulhaq was born on Nov 14, 1979 in Saharanpur-Uttar Pradesh. He first appeared on stage at the age of twelve. Later, he joined the \u0027Indian People\u0027s Theatre Association\u0027 and acted in numerous plays as a lead. In Mumbai he started his career as a writer for TV shows. After working as a \u0027Creative Consultant\u0027...",https://m.media-amazon.com/images/M/MV5BNTlkNmU1N2YtZGI2OC00YjkwLWIxM2MtNTZkMmJkYTQ4YWE1XkEyXkFqcGdeQXVyMjQwMDg0Ng@@._V1_.jpg,Inaamulhaq
48,1967-01-07,"Born Sahabzade Irfan Ali Khan, in Jaipur, Rajasthan (NW India) January 7, 1967 to a Pashto speaking Muslim family. Khan\u0027s mother, Begum Khan, was from the Tonk Hakim family and his father, Jagirdar Khan, from the Khajuriya village near the Tonk district, ran a tire business. The Khan family name comes from Turkish and Mongol languages and mean \",https://m.media-amazon.com/images/M/MV5BNDg3NDgxNzY4NF5BMl5BanBnXkFtZTcwODMxODQzMg@@._V1_.jpg,Irrfan Khan
49,1957-02-01,"Jaikishen was born in the Gujarati-speaking Shroff family on February 1, 1957. His dad\u0027s name is Kakubhai, his brother\u0027s is Hemant, and they live in Bandra, Bombay in a bungalow named \u0027Le Pepeyon\",https://m.media-amazon.com/images/M/MV5BYzczOGViODMtMWY1Yi00ZTAwLTkzZjItYzlmMzU0NmM5YjBmXkEyXkFqcGdeQXVyMjYwMDk5NjE@._V1_.jpg,Jackie Shroff
50,1970-12-03,"Shergill was born in a Sikh family in Gorakhpur, Uttar Pradesh. He moved to Punjab, the place of his ancestors, in 1985 where he studied in Yadavindra Public School, Patiala and Bikram College Patiala. He learnt acting from Sri Harpal Singh, and then moved to Mumbai to work in the entertainment industry. He\u0027s married to Priyanka Puri from Delhi ...",https://m.media-amazon.com/images/M/MV5BMjM2MTc1NTk5OF5BMl5BanBnXkFtZTgwOTI4NDczMDE@._V1_.jpg,Jimmy Sheirgill
51,1942-04-07,"Ravi Kapoor was born in a business family that dealt with imitation Jewelery and used to live in a chawl. While supplying jewelry to V. Shantaram, he was cast as Sandhya\u0027s double in the 1959 movie \u0027Navrang\u0027. His first break as a Bollywood leading man came in \u0027Geet Gaya Patharon Ne\u0027. Although Ravi Kapoor was born on April 7, 1942, Jeetendra birth\u0027s ...",https://m.media-amazon.com/images/M/MV5BYThkMTY3NDktMDBiNy00NWFhLWIyOWEtNGRkNDRiMGJjMjZiXkEyXkFqcGdeQXVyMTExNDQ2MTI@._V1_.jpg,Jeetendra
52,1955-03-03,"Jaspal Bhatti, the most popular social satirist in India, graduated from Punjab Engineering College, Chandigarh in North India, as an electrical engineer. He was famous for his street plays like his My Nonsense Club during his college days. Most of these plays were spoof ridiculing the corruption in the society. Before venturing out in to ...",https://m.media-amazon.com/images/M/MV5BZGQzZDgxNGMtZTdjYy00NzI3LThlOGItNjdmOTc5ZjQwYjcwXkEyXkFqcGdeQXVyNDAzNDk0MTQ@._V1_.jpg,Jaspal Bhatti
53,1957-08-14,"Johnny Lever, born in Andhra Pradesh and was brought up in Mumbai\u0027s King\u0027s Circle area (Dharavi). His mother tongue is Telugu. Johnny studied in Andhra Telugu School till the seventh grade but couldn\u0027t study further because of financial problems in his family, after which he decided to leave school and started working different kinds of odd jobs, ...",https://m.media-amazon.com/images/M/MV5BMjMyMTQzMjk1MV5BMl5BanBnXkFtZTgwMDg5MTMzOTE@._V1_.jpg,Johnny Lever
54,,"Jaswinder Bhalla is an actor and writer, known for Carry on Jatta (2012), Rangeelay (2013) and Jatt Boys Putt Jattan De (2013).",,Jaswinder Bhalla
55,1954-11-07,"Kamal Haasan was born November 7, 1954 in Paramakudi, Tamil Nadu. He debuted as a child artiste in the film \",https://m.media-amazon.com/images/M/MV5BYmUxNTY0MWItODQ2My00YWMyLWFmODgtNTY1MTQ2ZjEwYzdlXkEyXkFqcGdeQXVyMjYwMDk5NjE@._V1_.jpg,Kamal Haasan
56,1987-03-20,"Kangana was born on 20 March 1987 in Bhambla, near Manali, which is in the Mandi district of Himachal Pradesh. Her dad\u0027s name is Amardeep, who is a businessman and contractor, her mom, Asha, is a school-teacher. She has two sisters, eldest one is Rangoli, and she has a brother, Akshit, who is about a year younger than her. Her grandfather was an ...",https://m.media-amazon.com/images/M/MV5BMTA2NTg0ODA1ODJeQTJeQWpwZ15BbWU4MDM0NDkxNTMy._V1_.jpg,Kangana Ranaut
57,1979-12-03,"Konkona Sen Sharma is an awarding winning actress and the daughter of the celebrated actress and director Aparna Sen. Konkona is regarded as one of the most respected actresses in Bollywood with her memorable performances right from Mr. and Mrs. Iyer (2002) to Page 3 (2005), from Omkara (2006) to Life in a Metro (2007). Her singularly exquisite ...",https://m.media-amazon.com/images/M/MV5BMTU1NjUxNDYwNV5BMl5BanBnXkFtZTgwOTU3MDM0OTE@._V1_.jpg,Konkona Sen Sharma
